Title,Abstract
Nerolidol production in agroinfiltrated tobacco: Impact of protein stability and membrane targeting of strawberry (Fragraria ananassa) NEROLIDOL SYNTHASE1,"Abstract

The sesquiterpene alcohol nerolidol, synthesized from farnesyl diphosphate (FDP), mediates plant-insect interactions across multiple trophic levels with major implications for pest management in agriculture. We compared nerolidol engineering strategies in tobacco using agroinfiltration to transiently express strawberry (Fragraria ananassa) linalool/nerolidol synthase (FaNES1) either at the endoplasmic reticulum (ER) or in the cytosol as a soluble protein. Using solid phase microextraction and gas chromatography–mass spectrometry (SPME-GCMS), we have determined that FaNES1 directed to the ER via fusion to the transmembrane domain of squalene synthase or hydroxymethylglutaryl – CoA reductase displayed significant improvements in terms of transcript levels, protein accumulation, and volatile production when compared to its cytosolic form. However, the highest levels of nerolidol production were observed when FaNES1 was fused to GFP and expressed in the cytosol. This SPME-GCMS method afforded a limit of detection and quantification of 1.54 and 5.13?pg, respectively. Nerolidol production levels, which ranged from 0.5 to 3.0?µg/g F.W., correlated more strongly to the accumulation of recombinant protein than transcript level, the former being highest in FaNES-GFP transfected plants. These results indicate that while the ER may represent an enriched source of FDP that can be exploited in metabolic engineering, protein accumulation is a better predictor of sesquiterpene production."
New frontiers: harnessing pivotal advances in microbial engineering for the biosynthesis of plant-derived terpenoids,"Terpenoids are a vast and diverse class of molecules with industrial and medicinal importance. The majority of these molecules are produced across kingdom Plantae via specialized metabolism. Microorganisms, mainly Escherichia coli and Saccharomyces cerevisiae, have become choice platforms for the biosynthesis of terpenoids due to recent advances in synthetic biology and metabolic engineering. New techniques for gene discovery have expanded our search space for novel terpene synthesis pathways and unlocked unrealized potential for the microbial production of more complex derivatives. Additionally, numerous advances in host and pathway engineering have allowed for the production of terpenoids requiring oxidation and glycosylation, effectively expanding the potential target space. These advances will lay the foundation for the microbial biosynthesis of a seemingly infinite domain of terpenoids with varying applications."
New Light for Phytochemicals,"Light-emitting diode (LED) lighting technology with narrow-bandwidth illumination helps to reduce energy consumption on covered crops. Here, we discuss how this new technology, which provides flexible modification of light spectra, will open new avenues for natural modulation of medicinal and crop plant metabolomes for better colour, flavour, fragrance, and antioxidant properties."
New microbial fuels: a biotech perspective,"Bioethanol and plant oil-derived biodiesel are generally considered first generation biofuels. Recognizing their apparent disadvantages, scientists and engineers are developing more sustainable and economically feasible second generation biofuels. The new microbial fuels summarized here have great potential to become viable replacements or at least supplements of petroleum-derived liquid transportation fuels. Yields and efficiencies of the four metabolic pathways leading to these microbial fuels — mostly designed and optimized in Escherichia coli and Saccharomyces cerevisiae using modern tools of metabolic engineering and synthetic biology — and the robustness of the biocatalysts that convert the metabolic intermediates to, in some cases, finished and engine-ready fuels, will determine if they can be commercially successful and contribute to alleviating our dependence on fossil fuels."
Nonradioactive Assay for Cellular Dimethylallyl Diphosphate,"Abstract

A sensitive, nonradioactive method was developed to measure cellular levels of dimethylallyl diphosphate (DMAPP), a central intermediate of isoprenoid metabolism in nature. The assay is based on the hydrolysis of DMAPP in acid to the volatile hydrocarbon isoprene (2-methyl-1,3-butadiene), with subsequent analysis of isoprene by headspace gas chromatography with reduction gas detection. In the assay, cell samples are directly acidified with 4 M H2SO4 in sealed reaction vials. Therefore, there is no need to extract metabolites, purify them, and keep them stable prior to analysis, and degradative enzymatic activities are destroyed. DMAPP levels of 23 ± 4 nmol (g fresh weight)-1 [ca. 85 nmol (g dry weight)-1] and 80 ± 14 nmol (g fresh weight)-1 [ca. 296 nmol (g dry weight)-1] were measured in dark- and light-adapted leaves of Populus deltoides (Eastern cottonwood), respectively. Evidence is presented to show that DMAPP is the major leaf metabolite giving rise to isoprene following acid hydrolysis. DMAPP levels in Bacillus subtilis and Saccharomyces cerevisiae were determined to be 40.8 ± 16.7 pmol (OD600)-1 [ca. 638 pmol (mg dry weight)-1] and 6.3 ± 3.7 pmol (OD600)-1 [ca. 139 pmol (mg dry weight)-1], respectively. The method should be suitable for any cell or tissue type and isolated cellular organelles."
Nonradioactive assay for detecting isoprenyl diphosphate synthase activity in crude plant extracts using liquid chromatography coupled with tandem mass spectrometry,"Abstract

Terpenoids form the largest class of plant metabolites involved in primary and secondary metabolism. Isoprenyl diphosphate synthases (IDSs) catalyze the condensation of the C5 terpenoid building blocks, isopentenyl diphosphate and dimethylallyl diphosphate, to form geranyl diphosphate (C10), farnesyl diphosphate (C15), and geranylgeranyl diphosphate (C20). These branch point reactions control the flow of metabolites that act as precursors to each of the major terpene classes—monoterpenes, sequiterpenes, and diterpenes, respectively. Thus accurate and easily performed assays of IDS enzyme activity are critical to increase our knowledge about the regulation of terpene biosynthesis. Here we describe a new and sensitive nonradioactive method for carrying out IDS assays using liquid chromatography coupled with tandem mass spectrometry (LC–MS/MS) to detect the short-chain prenyl diphosphate products directly without dephosphorylation. Furthermore, we were able to separate cisoid and transoid isomers of both C10 enzyme products (geranyl diphosphate and neryl diphosphate) and three C15 products [(E,E)-, (Z,E)-, and (Z,Z)-farnesyl diphosphate]. By applying the method to crude protein extracts from various organs of Arabidopsis thaliana, Nicotiana attenuata, Populus trichocarpa, and Picea abies, we could determine their IDS activity in a reproducible fashion."
Novel Strategies and Platforms for Industrial Isoprenoid Engineering,"Metabolic engineering has emerged as an important tool for reconstructing heterologous isoprenoid metabolic pathways in microbial hosts. Here, we provide an overview of promising engineering strategies that have proven to be successful for the high-yield production of isoprenoids. Besides ‘conventional’ approaches, such as the ‘push–pull’ and protein engineering to optimize the isoprenoid flux and limited catalytic activity of enzymes, we review emerging strategies in the field, including compartmentalization between synthetic consortia members, novel bypass pathways for isoprenoid synthesis, cell-free systems, and improvement of the lipid content to overcome storage isoprenoid limitations. Pitfalls, along with lessons learned from the application of these strategies, will be addressed with the hope of guiding future efforts toward cost-effective and sustainable production of isoprenoids."
"Nutritional implications of ginger: chemistry, biological activities and signaling pathways","Abstract

Ginger (Zingiber officinale Roscoe) has been used as a food, spice, supplement and flavoring agent and in traditional medicines due to its beneficial characteristics such as pungency, aroma, nutrients and pharmacological activity. Ginger and ginger extracts were reported to have numerous effects, such as those on diabetes and metabolic syndrome, cholesterol levels and lipid metabolism, and inflammation, revealed by epidemiological studies. To understand the beneficial characteristics of ginger, especially its physiological and pharmacological activities at the molecular level, the biological effects of ginger constituents, such as monoterpenes (cineole, citral, limonene and a/ß-pinenes), sesquiterpenes (ß-elemene, farnesene and zerumbone), phenolics (gingerols, [6]-shogaol, [6]-paradol and zingerone) and diarylheptanoids (curcumin), and the associated signaling pathways are summarized. Ginger constituents are involved in biological activities, such as apoptosis, cell cycle/DNA damage, chromatin/epigenetic regulation, cytoskeletal regulation and adhesion, immunology and inflammation, and neuroscience, and exert their effects through specific signaling pathways associated with cell functions/mechanisms such as autophagy, cellular metabolism, mitogen-activated protein kinase and other signaling, and development/differentiation. Estrogens, such as phytoestrogens, are one of the most important bioactive materials in nature, and the molecular mechanisms of estrogen actions and the assays to detect them have been discussed. The molecular mechanisms of estrogen actions induced by ginger constituents and related applications, such as the chemoprevention of cancers, and the improvement of menopausal syndromes, osteoporosis, endometriosis, prostatic hyperplasia, polycystic ovary syndrome and Alzheimer's disease, were summarized by a comprehensive search of references to understand more about their health benefits and associated health risks."
"Occurrence and biosynthesis of plant sesterterpenes (C25), a new addition to terpene diversity","Abstract

Terpenes, the largest group of plant-specialized metabolites, have received considerable attention for their highly diverse biological activities. Monoterpenes (C10), sesquiterpenes (C15), diterpenes (C20), and triterpenes (C30) have been extensively investigated at both the biochemical and molecular levels over the past two decades. Sesterterpenes (C25), an understudied terpenoid group, were recently described by plant scientists at the molecular level. This review summarizes the plant species that produce sesterterpenes and describes recent developments in the field of sesterterpene biosynthesis, placing a special focus on the catalytic mechanism and evolution of geranylfarnesyl diphosphate synthase and sesterterpene synthase. Finally, we propose several questions to be addressed in future studies, which may help to elucidate sesterterpene metabolism in plants."
On the biosynthesis and evolution of apocarotenoid plant growth regulators,"Abstract

Carotenoids are an important source of metabolites with regulatory function, which include the plant hormones abscisic acid (ABA) and strigolactones (SLs), and several recently identified growth regulators and signaling molecules. These carotenoid-derivatives originate from oxidative breakdown of double bonds in the carotenoid polyene, a common metabolic process that gives rise to diverse carbonyl cleavage-products known as apocarotenoids. Apocarotenoids exert biologically important functions in all taxa. In plants, they are a major regulator of plant growth, development and response to biotic and abiotic environmental stimuli, and mediate plant’s communication with surrounding organisms. In this article, we provide a general overview on the biology of plant apocarotenoids, focusing on ABA, SLs, and recently identified apocarotenoid growth regulators. Following an introduction on carotenoids, we describe plant apocarotenoid biosynthesis, signal transduction, and evolution and summarize their biological functions. Moreover, we discuss the evolution of these intriguing metabolites, which has not been adequately addressed in the literature."
Opportunistic emissions of volatile isoprenoids,"Isoprene, monoterpenes and sesquiterpenes are synthesized and emitted by some plant species, but not all plant species have this ability. These volatile, nonessential isoprenoid compounds share the same biochemical precursors as larger essential isoprenoids such as gibberellic acids and carotenoids. They have many protective and ecological functions for the plant species that produce them, but plant species that do not produce these compounds also grow and reproduce successfully. Here, we develop an ‘opportunist hypothesis’ suggesting that (i) volatile isoprenoid production takes advantage of dimethylallyl diphosphate (DMAPP) and its isomer isopentenyl diphosphate (IPP), which are synthesized primarily to produce essential isoprenoids, and (ii) conditions affecting synthesis of the higher isoprenoids will affect the production and emission of volatile isoprenoids."
Orchid floral volatiles: Biosynthesis genes and transcriptional regulations,"Abstract

Floral scent and colour are key trait for many floricultural crops. Floral volatiles are biologically and economically important plant derived compounds and they play vital role in pollinator attraction, plant defense and interaction with surrounding the environment. Orchidaceae is one of the largest and most widespread families of flowering plants, with more than 25,000 species. Orchids are one of the most significant plants in ecologically adopted every habitation on earth. Floral volatiles is not limited in its role to pollinator attraction, it’s widely used for perfumes, cosmetics, flavourings and therapeutic applications. Even though biochemistry of floral volatiles is still new field for investigation.Due to importance of the plant biology orchid floral scent research were deeply needed. Analysis of the biosynthesis mechanisms involved in floral scent is necessary to understand the fine-scale molecular functions and to breed to new cultivars through floral volatile genetic engineering approaches. Now a days many researchers developed floral scent models in plants. However, little is known about the pathways responsible for floral scent in orchids, due to the long life cycle and large genome size. Only some terpenoid pathways were reported in orchids. In this review, we mainly concentrated orchid floral volatile regulation and compounds synthesis responsible pathways. Moreover,we mentioned emission of orchid floral volatiles and their function in pollination ecology. This information will provide a basic information on orchid floral scent research."
Overproduction of isoprenoids by Saccharomyces cerevisiae in a synthetic grape juice medium in the absence of plant genes,"Abstract

The objective of this work is to demonstrate if the hexaprenyl pyrophosphate synthetase Coq1p might be involved in monoterpenes synthesis in Saccharomyces cerevisiae, although its currently known function in yeast is to catalyze the first step in ubiquinone biosynthesis. However, in a BY4743 laboratory strain, the presence of an empty plasmid in a chemically defined grape juice medium results in a statistically significant increase of linalool, (E)-nerolidol and (E,E)-farnesol. When COQ1 is overexpressed from a plasmid, the levels of the volatile isoprenoids are further increased. Furthermore, overexpression of COQ1 in the same genetic context but with a mutated farnesyl pyrophosphate synthetase (erg20 mutation K197E), results in statistically significant higher levels of linalool (above 750?µg/L), geraniol, a-terpineol, and the sesquiterpenes, farnesol and nerolidol (total concentration of volatile isoprenoids surpasses 1300?µg/L). We show that the levels of monoterpenes and sesquiterpenes that S. cerevisiae can produce, in the absence of plant genes, depend on the composition of the medium and the genetic context. To the best of our knowledge, this is the highest level of linalool produced by S. cerevisiae up to now. Further research will be needed for understanding how COQ1 and the medium composition might interact to increase flavor complexity of fermented beverages."
Pathway engineering for functional isoprenoids,"Pathway engineering is to engineer biosynthetic pathways for compounds of interests in heterologous organisms such as microbes and higher plants, which has also been one of the most important fields in metabolic engineering and synthetic biology. This review focuses on pathway engineering researches for the production of functional isoprenoids containing monoterpenes, sesquiterpenes, diterpenes, and triterpenes as well as carotenoids and for the elucidation of relevant biosynthesis genes and enzymes, which have been performed in the last two years. As microbial hosts, Escherichia coli and Saccharomyces cerevisiae have often been employed, since they, specifically the former, are fully amenable to genetic manipulations with extensive molecular resources. Various crops have also been used as the hosts for engineering pathways of functional isoprenoids of the plant origin, particularly carotenoids."
Photosynthetic performance and volatile organic compounds profile in Eucalyptus globulus after UVB radiation,"Abstract

Economically important forest species as Eucalyptus globulus face risks associated with climate changes, whose immediate and long-term damages are yet to account. The aim of this study was to decipher the impacts of UV-B radiation on the physiological performance and metabolome profile of leaves of Eucalyptus juvenile plants. For that, three-month-old plants were treated for two days to a total effective radiation of 12 kJ m-2. One and 11 d after treatment the samples were collected for photosynthetic analyses. UV-B did not affect the photochemical efficiency or gas exchange, but the total soluble sugars (TSS), starch levels and pigment contents were changed. Changes in TSS and pigment contents persisted in time after the end of exposure. The profile of volatile metabolites (1 and 11 days after stress removal) was analyzed by HS-SPME/GC-IT-MS, and showed abundance of monoterpenes, sesquiterpenes and aldehydes. One day after the stress removal, an increase of aldehydes was observed and a decrease of some monoterpenes and sesquiterpenes. Eleven days after stress removal, some monoterpenes and sesquiterpenes decreased to values closer to those of control. The absence of mortality, and the minor effects observed in photosynthesis suggest a high tolerance profile of this species to the UV-B dose used, which may be justified by changes at the level of primary metabolism (involving sugars) and secondary (e.g. terpenes) observed in response to UV's. The correlations of these changes with potential functional adaptations are discussed here."
Phylogenetically distant group of terpene synthases participates in cadinene and cedrane-type sesquiterpenes accumulation in Taiwania cryptomerioides,"Abstract

Along with the species evolution, plants have evolved ways to produce a different collection of terpenoids to accommodate its biotic and abiotic environment, and terpene synthase (TPS) is one of the major contributors to various terpene compounds. The timber of a monotypic and relictual conifer species of Cupressace, Taiwania cryptomerioides, has excellent durability, and one of the essential factors for Taiwania to resist decay and insect pests is sesquiterpene. Compared to other conifers, Taiwania has much higher abundance of cadinene-type sesquiterpenes, and the presence of cedrene-type sesquiterpenes. To understand sesquiterpene biosynthesis in Taiwania, we functionally characterized 10 T. cryptomerioides TPSs (TcTPSs) in vivo or in planta, which could catalyze sesquiterpene formation and potentially are involved in biosynthesis of diverse sesquiterpenoids in Taiwania. The distant phylogenetic relationship and the intron loss event of TcTPSs correlate to the differentiation of chemical profile Taiwania compared to other conifers. Furthermore, we identified TcTPS3 and TcTPS12 as d-cadinene synthase, and TcTPS6 as cedrol synthase, which demonstrates the important contributions of dynamic evolution in TPSs to the chemical diversity in plants. Combining with functional characterization and comparison of catalytic residues, we conclude at least three catalytic routes for sesquiterpene biosynthesis in this species, and the skeleton diversity has been expended in T. cryptomeriodes."
Plant Secondary Compounds in Soil and Their Role in Belowground Species Interactions,"Knowledge of the effect of plant secondary compounds (PSCs) on belowground interactions in the more diffuse community of species living outside the rhizosphere is sparse compared with what we know about how PSCs affect aboveground interactions. We illustrate here that PSCs from foliar tissue, root exudates, and leaf litter effectively influence such belowground plant–plant, plant–microorganism, and plant–soil invertebrate interactions. Climatic factors can induce PSC production and select for different plant chemical types. Therefore, climate change can alter both quantitative and qualitative PSC production, and how these compounds move in the soil. This can change the soil chemical environment, with cascading effects on both the ecology and evolution of belowground species interactions and, ultimately, soil functioning."
"Plant volatile terpenoid metabolism: Biosynthetic genes, transcriptional regulation and subcellular compartmentation","Abstract

Volatile terpenoids released from different plant parts play crucial roles in pollinator attraction, plant defense, and interaction with the surrounding environment. Two distinct pathways localized in different subcellular compartments are responsible for the biosynthesis of these compounds. Recent advances in the characterization of genes and enzymes responsible for substrate and end product biosynthesis as well as efforts in metabolic engineering have revealed new aspects of volatile terpenoid biosynthesis. This review summarizes recent progress in the characterization of volatile terpenoid biosynthetic genes, their spatio-temporal expression patterns and subcellular localization of corresponding proteins. In addition, recent information obtained from metabolic engineering is discussed."
Plant volatiles: Using Scented molecules as food additives,"Abstract
Background

Secondary metabolism of plants produces molecules that are widely used in the food industry for many years. The demand for these molecules has been increasing, and special focus has been given to volatile molecules.

Scope

The study of secondary metabolites with special focus on the volatile molecules is overviewed, explaining their bioactivities and examples of application in the food industry.

Approach

Systematic analysis of volatiles and their applications. Specific analysis of volatile components of plants and their use as active packaging and airborne food preservatives.

Key findings

Some work has been done regarding volatiles in terms of food preservation but is focused mostly on postharvest protection. Considering the number of studies regarding the use of volatiles, the industry should start implementing these molecules for more sustainable approaches to preservation.

Conclusions

The food industry has researched plant volatiles for some years, but the focus has been almost exclusively on postharvest protection, and more research can be directed to other food categories. Technology to overcome limitations of plant volatiles is expected to improve, placing pressure on regulatory bodies to allow these molecules in foods, on par with consumer and industry preference for natural-based molecules used in foods."
Plant-derived Secondary Organic Material in the Air and Ecosystems,"Biogenic secondary organic aerosol (SOA) and deposited secondary organic material (SOM) are formed by oxidation of volatile organic compounds (VOCs) emitted by plants. Many SOA compounds have much longer chemical lifetimes than the original VOC, and may accumulate on plant surfaces and in soil as SOM because of their low volatility. This suggests that they may have important and presently unrecognized roles in plant adaptation. Using reactive plant terpenoids as a model we propose a three-tier (atmosphere–vegetation–soil) framework to better understand the ecological and evolutionary functions of SOM. In this framework, SOA in the atmosphere is known to affect solar radiation, SOM on the plant surfaces influences the interactive organisms, and wet and dry deposition of SOM on soil affects soil organisms."
Plant-Derived Terpenes: A Feedstock for Specialty Biofuels,"Research toward renewable and sustainable energy has identified specific terpenes capable of supplementing or replacing current petroleum-derived fuels. Despite being naturally produced and stored by many plants, there are few examples of commercial recovery of terpenes from plants because of low yields. Plant terpene biosynthesis is regulated at multiple levels, leading to wide variability in terpene content and chemistry. Advances in the plant molecular toolkit, including annotated genomes, high-throughput omics profiling, and genome editing, have begun to elucidate plant terpene metabolism, and such information is useful for bioengineering metabolic pathways for specific terpenes. We review here the status of terpenes as a specialty biofuel and discuss the potential of plants as a viable agronomic solution for future terpene-derived biofuels."
