Title,Abstract
Integrated metabolome and transcriptome analysis reveals candidate genes involved in metabolism of terpenoids and phthalides in celery seeds,"Abstract

Celery (Apium graveolens L.) seeds have a unique aroma and can be used in the pharmaceutical industry. Terpenoids are the main volatile organic compounds (VOCs) of celery seed essential oil, and phthalides are the source of its aroma. However, thus far, no studies have been conducted on the metabolism of terpenoids and phthalides in celery. In this study, 195 VOCs were detected in celery seeds by using headspace injection combined with gas chromatography–mass spectrometry (GC–MS). The content of 85 VOCs, including 20 terpenoids and 6 phthalides, was found to be significantly different during the five stages of celery seed development. Based on the pattern of changes in the concentrations of terpenoids and phthalides, an integrated transcriptome and metabolome analysis of three developmental celery seed stages was performed. The results showed that 11 differentially expressed structural genes involved in the metabolism of terpenoids have a positive correlation coefficient with 16 terpenoids, while 103 differentially expressed transcription factor genes are correlated with these 11 differentially expressed genes (DEGs). Among these differentially expressed transcription factor genes, two basic helix-loop-helix (bHLH) genes are similar with Arabidopsis thaliana bHLH gene (MYC2), which has already known to be involved in the regulation of terpenoid metabolism. The results of the integrated analysis also revealed that 88 differentially expressed transcription factor genes are related to 6 phthalides, and one myeloblastosis (MYB) gene is similar with petunia MYB gene (ODORANT1), which is involved in the regulation of the metabolism of volatile benzene compounds in petunia (Pharbitis nil) flowers. Therefore, this study has laid a foundation for further research related to the identification of key genes that regulate the metabolism of terpenoids and phthalides in celery. Moreover, these results can contribute significantly to the improvement in the quality of celery seed essential oil."
Medicago truncatula (E)-ß-ocimene synthase is induced by insect herbivory with corresponding increases in emission of volatile ocimene,"Abstract

Virtually all plants are able to recognize attack by herbivorous insects and release volatile organic compounds (VOC) in response. Terpenes are the most abundant and varied class of insect-induced VOC from plants. Four genes encoding putative terpene synthases (MtTps1, MtTps2, MtTps3 and MtTps4) were shown to accumulate in Medicago truncatula Gaertn. in response to Spodoptera exigua (Hübner) feeding and methyl jasmonate treatment in a previous study [S.K. Gomez, M.M. Cox, J.C. Bede, K.K. Inoue, H.T. Alborn, J.H. Tumlinson, K.L. Korth, Lepidopteran herbivory and oral factors induce transcripts encoding novel terpene synthases in Medicago truncatula, Arch. Insect Biochem. Physiol. 58 (2005) 114–127.] The focus of the current study is the functional characterization of one (MtTps4) of these four genes. Using an M. truncatula cDNA clone, the insect-inducible putative terpene synthase was expressed in Escherichiacoli and shown to convert geranyl diphosphate (GPP) into the monoterpene (E)-ß-ocimene as the major product. The clone was therefore designated M. truncatula (E)-ß-ocimene synthase (MtEBOS). Transcripts encoding this enzyme accumulate in M. truncatula leaves in response to exogenous jasmonic acid treatments, lepidopteran herbivory, and lepidopteran oral secretions. Treatment with the ethylene precursor, 1-aminocyclopropane-1-carboxylic acid (ACC) did not cause an increase in MtEBOS transcripts. The volatile (E)-ß-ocimene was released from leaves of both undamaged and insect-damaged plants, but at levels two-fold higher in insect-damaged M. truncatula. Although leaves have low constitutive levels of MtEBOS transcripts, RNA blot analysis indicates no constitutive expression in flowers, stems or roots. The strong insect-induced expression of this gene, and its correspondence with release of volatile ocimene, suggest that it plays an active role in indirect insect defenses in M. truncatula."
Metabolic engineering and synthetic biology approaches driving isoprenoid production in Escherichia coli,"Abstract

Isoprenoids comprise the largest family of natural organic compounds with many useful applications in the pharmaceutical, nutraceutical, and industrial fields. Rapid developments in metabolic engineering and synthetic biology have facilitated the engineering of isoprenoid biosynthetic pathways in Escherichia coli to induce high levels of production of many different isoprenoids. In this review, the stem pathways for synthesizing isoprene units as well as the branch pathways deriving diverse isoprenoids from the isoprene units have been summarized. The review also highlights the metabolic engineering efforts made for the biosynthesis of hemiterpenoids, monoterpenoids, sesquiterpenoids, diterpenoids, carotenoids, retinoids, and coenzyme Q10 in E. coli. Perspectives and future directions for the synthesis of novel isoprenoids, decoration of isoprenoids using cytochrome P450 enzymes, and secretion or storage of isoprenoids in E. coli have also been included."
Metabolic engineering of Escherichia coli for production of valerenadiene,"Abstract

Valeriana officinalis is a medicinal herb which produces a suite of compounds in its root tissue useful for treatment of anxiety and insomnia. The sesquiterpene components of the root extract, valerenic acid and valerena-1,10-diene, are thought to contribute to most of the observed anxiolytic of Valerian root preparations. However, valerenic acid and its biosynthetic intermediates are only produced in low quantities in the roots of V. officinalis. Thus, in this report, Escherichia coli was metabolically engineered to produce substantial quantities of valerena-1,10-diene in shake flask fermentations with decane overlay. Expression of the wildtype valerenadiene synthase gene (pZE-wvds) resulted in production of 12 µg/mL in LB cultures using endogenous FPP metabolism. Expression of a codon-optimized version of the valerenadiene synthase gene (pZE-cvds) resulted in 3-fold higher titers of valerenadiene (32 µg/mL). Co-expression of pZE-cvds with an engineered methyl erythritol phosphate (MEP) pathway improved valerenadiene titers 65-fold to 2.09 mg/L valerenadiene. Optimization of the fermentation medium to include glycerol supplementation enhanced yields by another 5.5-fold (11.0 mg/L valerenadiene). The highest production of valerenadiene resulted from engineering the codon-optimized valerenadiene synthase gene under strong Ptrc and PT7 promoters and via co-expression of an exogenous mevalonate (MVA) pathway. These efforts resulted in an E. coli production strain that produced 62.0 mg/L valerenadiene (19.4 mg/L/OD600 specific productivity). This E. coli production platform will serve as the foundation for the synthesis of novel valerenic acid analogues potentially useful for the treatment of anxiety disorders."
Metabolic engineering of microbial pathways for advanced biofuels production,"Production of biofuels from renewable resources such as cellulosic biomass provides a source of liquid transportation fuel to replace petroleum-based fuels. This endeavor requires the conversion of cellulosic biomass into simple sugars, and the conversion of simple sugars into biofuels. Recently, microorganisms have been engineered to convert simple sugars into several types of biofuels, such as alcohols, fatty acid alkyl esters, alkanes, and terpenes, with high titers and yields. Here, we review recently engineered biosynthetic pathways from the well-characterized microorganisms Escherichia coli and Saccharomyces cerevisiae for the production of several advanced biofuels."
Metabolic engineering of microorganisms for the synthesis of plant natural products,"Abstract

Of more than 200,000 plant natural products known to date, many demonstrate important pharmacological activities or are of biotechnological significance. However, isolation from natural sources is usually limited by low abundance and environmental, seasonal as well as regional variation, whereas total chemical synthesis is typically commercially unfeasible considering the complex structures of most plant natural products. With advances in DNA sequencing and recombinant DNA technology many of the biosynthetic pathways responsible for the production of these valuable compounds have been elucidated, offering the opportunity of a functional integration of biosynthetic pathways in suitable microorganisms. This approach offers promise to provide sufficient quantities of the desired plant natural products from inexpensive renewable resources. This review covers recent advancements in the metabolic engineering of microorganisms for the production of plant natural products such as isoprenoids, phenylpropanoids and alkaloids, and highlights general approaches and strategies to gain access to the rich biochemical diversity of plants by employing the biosynthetic power of microorganisms."
Metabolic engineering of natural products in plants; tools of the trade and challenges for the future,"Plant natural products play essential roles in plant survivability and many of them are used as nutrients, colorants, flavors, fragrances, and medicines. Genetic engineering of plants for natural products can help alleviate the demands for limited natural resources. Successes in enhancing production capacities have included manipulating blocks of genes coding for segments of pathways, over-expression of putative rate-limiting steps in pathways, expression of transcription factors regulating the entire metabolic pathways, and the construction of novel branch pathways capable of diverting carbon to the biosynthesis of unique metabolites in unexpected intracellular compartments. Further enhancements are likely if more efficient pathways can be constructed, providing for the efficient channeling of intermediates to final products, and if the means for sequestering natural products in planta can be accomplished."
Metabolic engineering of Synechocystis sp. PCC 6803 for the photoproduction of the sesquiterpene valencene,"Abstract

Cyanobacteria are extremely adaptable, fast-growing, solar-powered cell factories that, like plants, are able to convert carbon dioxide into sugar and oxygen and thereby produce a large number of important compounds. Due to their unique phototrophy-associated physiological properties, i.e. naturally occurring isoprenoid metabolic pathway, they represent a highly promising platform for terpenoid biosynthesis. Here, we implemented a carefully devised engineering strategy to boost the biosynthesis of commercially attractive plant sequiterpenes, in particular valencene. Sesquiterpenes are a diverse group of bioactive metabolites, mainly produced in higher plants, but with often low concentrations and expensive downstream extraction. In this work we successfully demonstrate a multi-component engineering approach towards the photosynthetic production of valencene in the cyanobacterium Synechocystis sp. PCC 6803. First, we improved the flux towards valencene by markerless genomic deletions of shc and sqs. Secondly, we downregulated the formation of carotenoids, which are essential for viability of the cell, using CRISPRi on crtE. Finally, we intended to increase the spatial proximity of the two enzymes, ispA and CnVS, involved in valencene formation by creating an operon construct, as well as a fusion protein. Combining the most successful strategies resulted in a valencene production of 19 mg/g DCW in Synechocystis. In this work, we have devised a useful platform for future engineering steps."
Metabolic Engineering Strategies to Convert Carbohydrates to Aviation Range Hydrocarbons,"Abstract

Numerous hydrocarbon molecules with properties similar to aviation fuels can be found in nature, but are often only produced at low quantities in their native hosts. This chapter summarizes recent progress in the engineering of microbial cell factories for the production of the two major molecule classes: fatty acid-derived alkanes/alkanes and isoprenoids. It starts with a brief introduction to metabolic engineering. For each of the two molecule classes, it provides information on biosynthetic pathways as well as engineering strategies to enhance their formation in the microbial hosts. While most of these endeavours are still at the proof-of concept stage, the first commercial examples are beginning to emerge."
Metabolism of terpenes in the response of grape (Vitis vinifera L.) leaf tissues to UV-B radiation,"Abstract

This study investigated the terpene profiles as determined by GC–EIMS analysis of in vitro cultured plants of Vitis vinifera exposed to a “field-like” dose of UV-B (4.75 kJ m-2 d-1) administered at two different fluence rates (low, 16 h at 8.25 µW cm-2, and high 4 h at 33 µW cm-2). Low UV-B treatment increased levels of the membrane-related triterpenes sitosterol, stigmasterol and lupeol, more notable in young leaves, suggesting elicitation of a mechanism for grapevine acclimation. By contrast, accumulation of compounds with antioxidant properties, diterpenes a and ? tocopherol and phytol, the sesquiterpene E-nerolidol and the monoterpenes carene, a-pinene and terpinolene had maximum accumulation under high UV-B, which was accentuated in mature leaves. Also the levels of the sesquiterpenic stress-related hormone abscisic acid (ABA) increased under high UV-B, although 24 h post irradiation ABA concentrations decreased. Such increments of antioxidant terpenes along with ABA suggest elicitation of mechanism of defense. The adaptative responses induced by relatively low UV-B irradiations as suggested by synthesis of terpenes related with membrane stability correlated with augments in terpene synthase activity."
Metabolite and target transcript analyses during Crocus sativus stigma development,"Abstract

Saffron, the desiccated stigmas of Crocus sativus, is highly appreciated for its peculiar colour, flavour and aroma. Several studies have been conducted with the spice, but little is known about the evolution of volatile and non-volatile compounds generated during the development of the stigma. In this study, we have followed these compounds, with special attention to those of isoprenoid origin (carotenoids and monoterpenes), which are responsible for the organoleptic properties of saffron. The main compounds that accumulated throughout stigma development in C. sativus were crocetin, its glucoside derivatives and picrocrocin, all of which increased as stigmas reached a fully developed stage. The volatile composition of C. sativus stigmas changed notably as stigmas developed with each developmental stage being characterized by a different volatile combination. In red stigmas, ß-cyclocitral, the 7,8 cleavage product of ß-carotene, was highly produced, suggesting the implication of both ß-carotene and zeaxanthin in crocetin formation. As stigmas matured, hydroxy-ß-ionone and ß-ionone were produced while safranal, the most typical aroma compound of the processed spice, was only detected at low levels. However, a safranal-related compound 2,2,2-trimethyl-2-cyclohexene-1,4-dione (4-oxoisophorone) increased rapidly at the anthesis stage and also in senescent stigmas. Monoterpenes were mainly emitted at the time of anthesis and the emission patterns followed the expression patterns of two putative terpene synthases CsTS1 and CsTS2. Fatty acid derivates, which predominated at the earlier developmental stages, were observed at low levels in later stages."
Microbial production of farnesol (FOH): Current states and beyond,"Abstract

Farnesol (FOH) recently has been paid close attention because of its intrinsic properties as a cosmetic, pharmaceutical and industrial material. However, extraction from natural sources and chemical synthesis often suffer from the low yield and purity. Metabolic engineering of microorganisms for FOH production is an alternative way to meet the ever-growing demands. Several efforts have been done to make it possible to produce FOH from microorganisms including S. cerevisiae and E. coli. With developments of systems biology and synthetic biology, an optimal industrial microorganism can be expected to produce FOH cost-effectively. This review aims to give an update on the various facets of FOH synthesis pathway including the features of involved genes and enzymes, and recent progresses on FOH production. Combining traditional metabolic engineering with these new fascinating molecular, systems biology and synthetic biology tools will provide a better understanding of FOH biosynthesis and a great potential of microbial production."
"Mild versus severe stress and BVOCs: thresholds, priming and consequences","Plant-generated volatile organic compounds (BVOCs) play key roles in large-scale atmospheric processes and serve the plants as important defense and signal molecules. The main emphasis in quantitative BVOC studies has been on constitutive emissions of isoprene and specific monoterpene species that are present in only certain emitting plant species. However, environmental and biotic stresses can induce emissions of an array of organic compounds in any plant species, whereas the magnitude of emissions induced by given stress depends on stress tolerance, timing, duration and severity (mild versus strong) of the stress. The main view put forward in this review is that quantitative understanding of stress effects is the key for constructing realistic models of both constitutive and induced BVOC emissions."
"Molecular cloning and characterization of (+)-epi-a-bisabolol synthase, catalyzing the first step in the biosynthesis of the natural sweetener, hernandulcin, in Lippia dulcis","Abstract

Hernandulcin, a C15 sesquiterpene ketone, is a natural sweetener isolated from the leaves of Lippia dulcis. It is a promising sugar substitute due to its safety and low caloric potential. However, the biosynthesis of hernandulcin in L. dulcis remains unknown. The first biochemical step of hernandulcin is the synthesis of (+)-epi-a-bisabolol from farnesyl diphosphate, which is presumed to be catalyzed by a unique sesquiterpene synthase in L. dulcis. In order to decipher hernandulcin biosynthesis, deep transcript sequencings (454 and Illumina) were performed, which facilitated the molecular cloning of five new sesquiterpene synthase cDNAs from L. dulcis. In vivo activity evaluation of these cDNAs in yeast identified them as the sesquiterpene synthases for a-copaene/d-cadinene, bicyclogermacrene, ß-caryophyllene, trans-a-bergamotene, and a-bisabolol. The engineered yeast could synthesize a significant amount (~0.3 mg per mL) of a-bisabolol in shake-flask cultivation. This efficient in vivo production was congruent with the competent kinetic properties of recombinant a-bisabolol synthase (Km 4.8 µM and kcat 0.04 s-1). Detailed chemical analyses of the biosynthesized a-bisabolol confirmed its configuration to be (+)-epi-a-bisabolol, the core skeleton of hernandulcin. These results demonstrated that enzymatic, stereoselective synthesis of (+)-epi-a-bisabolol can be achieved, promising the heterologous production of a natural sweetener, hernandulcin."
Molecular cloning and characterization of drimenol synthase from valerian plant (Valeriana officinalis),"Abstract

Drimenol, a sesquiterpene alcohol, and its derivatives display diverse bio-activities in nature. However, a drimenol synthase gene has yet to be identified. We identified a new sesquiterpene synthase cDNA (VoTPS3) in valerian plant (Valeriana officinalis). Purification and NMR analyses of the VoTPS3-produced terpene, and characterization of the VoTPS3 enzyme confirmed that VoTPS3 synthesizes (-)-drimenol. In feeding assays, possible reaction intermediates, farnesol and drimenyl diphosphate, could not be converted to drimenol, suggesting that the intermediate remains tightly bound to VoTPS3 during catalysis. A mechanistic consideration of (-)-drimenol synthesis suggests that drimenol synthase is likely to use a protonation-initiated cyclization, which is rare for sesquiterpene synthases. VoTPS3 can be used to produce (-)-drimenol, from which useful drimane-type terpenes can be synthesized."
"Molecular cloning, characterization and expression analysis of LoTPS2 and LoTPS4 involved in floral scent formation in oriental hybrid Lilium variety ‘Siberia’","Lilies are a commercially significant cut flower worldwide due not only to their elegant shape but also to their appealing scent. Among Lilium varieties, Lilium ‘Siberia’ is a cultivar that is prominent and highly favored by consumers due to its snowy white color and strong floral scent. Here, two terpene synthase genes (LoTPS2 and LoTPS4) that are responsible for floral scent production in Lilium ‘Siberia’ were cloned and functionally characterized. Recombinant LoTPS2 specifically catalyzed the formation of (E, E)-a-farnesene from FPP. Recombinant LoTPS4 is a multiproduct enzyme that produces D-limonene and ß-myrcene as major volatile compounds and ß-phellandrene, (+)-4-carene and 3-carene as minor products from GPP. Furthermore, LoTPS4 generates trans-a-bergamotene as a major product and di-epi-a-cedrene, a-cubebene and (E)-ß-farnesene as minor compounds from FPP. Subcellular localization analysis using GFP fusion constructs revealed that LoTPS2 was localized in the cytosol, whereas LoTPS4 was localized in plastids. Real-time PCR analysis showed that LoTPS2 was highly expressed in the petals and sepals of the flower, while LoTPS4 was highly expressed in the filament of the flower. Moreover, mechanical wounding of flowers revealed that LoTPS2 showed a strong response to wounding via a rapid increase in its mRNA transcript level. Our results will assist scientists in exploring the molecular mechanisms of terpene biosynthesis in this species and will provide new insight into the biotechnological modification of the floral bouquet in Lilium."
Review on plant terpenoid emissions worldwide and in China,"Abstract

Biogenic volatile organic compounds (BVOCs), particularly terpenoids, can significantly drive the formation of ozone (O3) and secondary organic aerosols (SOA) in the atmosphere, as well as directly or indirectly affect global climate change. Understanding their emission mechanisms and the current progress in emission measurements and estimations are essential for the accurate determination of emission characteristics, as well as for evaluating their roles in atmospheric chemistry and climate change. This review summarizes the mechanisms of terpenoid synthesis and release, biotic and abiotic factors affecting their emissions, development of emission observation techniques, and emission estimations from hundreds of published papers. We provide a review of the main observations and estimations in China, which contributes a significant proportion to the total global BVOC emissions. The review suggests the need for further research on the comprehensive effects of environmental factors on terpenoid emissions, especially soil moisture and nitrogen content, which should be quantified in emission models to improve the accuracy of estimation. In China, it is necessary to conduct more accurate measurements for local plants in different regions using the dynamic enclosure technique to establish an accurate local emission rate database for dominant tree species. This will help improve the accuracy of both national and global emission inventories. This review provides a comprehensive understanding of terpenoid emissions as well as prospects for detailed research to accurately describe terpenoid emission characteristics worldwide and in China."
Rhizosphere associated bacteria trigger accumulation of terpenes in leaves of Vitis vinifera L. cv. Malbec that protect cells against reactive oxygen species,"Abstract

It has been proposed that plant growth promoting rhizobacteria (PGPR) stimulate plant growth and development by inducing the biosynthesis of secondary metabolites, like terpenes, which reduce stress incidence. Three bacteria previously isolated from grapevine roots and adjacent soil (Microbacterium imperiale Rz19M10, Kocuria erythromyxa Rt5M10 and Terribacillus saccharophilus Rt17M10) were tested as PGPR. After 30 days since root inoculation of in vitro grown Vitis vinifera cv. Malbec plants, the monoterpenes a-pinene, terpinolene and 4-carene, and the sesquiterpene nerolidol were detected only in bacterized-plant leaves. Also, the concentrations of the diterpenes a and ?-tocopherol, and the sterols sitosterol and lupeol were significantly enhanced compared to controls. The leaf extracts of bacterized plants showed photoprotective properties since they decreased the oxygen consumption (that is photo-oxidation) of the amino acid tryptophan in a sensitized solution, thus indicating an increment of the antioxidant capacity of the tissues. In addition, experiments with a-pinene and nerolidol standards showed the capability to intercept reactive oxygen species in the sensitized solution. Moreover, bacterized plants infected with the pathogen Botrytis cinerea showed a reduction in the lesion diameter compared with non-bacterized plants. The results suggest that M. imperiale, K. erythromyxa and mainly T. saccharophilus are able to induce a systemic response that trigger increases on monoterpenes, sesquiterpenes, tocopherols and membrane sterols. These compounds enhance the antioxidant capacity in leaf tissues that may help grapevine to cope with stresses."
