Title,Abstract
Production of Macrocyclic Sesqui- and Diterpenes in Heterologous Microbial Hosts: A Systems Approach to Harness Nature’s Molecular Diversity,"Macrocyclic sesqui- (C15) and diterpenes (C20) are a functionally diverse group of natural products with versatile bioactivities encompassing anticancer, antimicrobial and insecticidal agents. Structural complexity prevents economically efficient total synthesis of these higher terpenoids. Heterologous production in recombinant whole-cell biocatalysts is an emerging alternative. Conventional cell systems (i.e., Escherichia coli and Saccharomyces cerevisiae) frequently suffer from low volumetric yields. However, recent combinations of metabolic, enzyme and process engineering in conjunction with systems biology allow significant improvements towards economically viable processes. This Review analyzes research trends in the dynamic fields of terpene-centered microbial cell systems and enzyme engineering. An outlook is given on emerging microbial hosts, which may simplify cellular engineering towards higher product titers."
Production of the Inaccessible Sesquiterpene (-)-5-Epieremophilene by Metabolically Engineered Escherichia coli,"(-)-5-Epieremophilene, an epimer of the versatile sesquiterpene (+)-valencene, is an inaccessible natural product catalyzed by three sesquiterpene synthases (SmSTPSs1-3) of the Chinese medicinal herb Salvia miltiorrhiza, and its biological activity remains less explored. In this study, three metabolically engineered Escherichia coli strains were constructed for (-)-5-epieremophilene production with yields of 42.4–76.0 mg/L in shake-flask culture. Introducing an additional copy of farnesyl diphosphate synthase (FDPS) gene through fusion expression of SmSTPS1-FDPS or dividing the FDP synthetic pathway into two modules resulted in significantly improved production, and ultimately 250 mg of (-)-5-epieremophilene were achieved. Biological assay indicated that (-)-5-epieremophilene showed significant antifeedant activity against Helicoverpa armigera (EC50=1.25 µg/cm2), a common pest of S. miltiorrhiza, implying its potential defensive role in the plant. The results provided an ideal material supply for studying other potential biological activities of (-)-5-epieremophilene, and also a strategy for manipulating terpene production in engineered E. coli using synthetic biology."
Recent advances in allelopathy for weed control: from knowledge to applications,"Allelopathy is the biological phenomenon of chemical interactions between living organisms in the ecosystem, and must be taken into account in addressing pest and weed problems in future sustainable agriculture. Allelopathy is a multidisciplinary science, but in some cases, aspects of its chemistry are overlooked, despite the need for a deep knowledge of the chemical structural characteristics of allelochemicals to facilitate the design of new herbicides. This review is focused on the most important advances in allelopathy, paying particular attention to the design and development of phenolic compounds, terpenoids and alkaloids as herbicides. The isolation of allelochemicals is mainly addressed, but other aspects such as the analysis and activities of derivatives or analogs are also covered. Furthermore, the use of allelopathy in the fight against parasitic plants is included. The past 12 years have been a prolific period for publications on allelopathy. This critical review discusses future research areas in this field and the state of the art is analyzed from the chemist's perspective. © 2019 Society of Chemical Industry"
Reduced levels of volatile emissions in jasmonate-deficient spr2tomato mutants favour oviposition by insect herbivores,"Tomato plants release volatile organic compounds (VOCs) following insect or mechanical damage. In this study, the constitutive and wound-induced emission levels of VOCs in suppressor of prosystemin-mediated responses2 (spr2) mutant plants, compromised in linolenic acid (LA) and jasmonic acid (JA) synthesis, and in 35S::prosystemin (35S::prosys) plants, having upregulated direct defence responses, were compared. The spr2 mutants produced constitutively lower levels of VOCs, which were nonetheless increased in response to (a)biotic damage, although at lower levels than wild-type (Wt) and 35S::prosys plants. No significant differences in VOC emissions were detected between the latter two genotypes, thereby suggesting that systemin does not regulate indirect defence responses, whereas differences in fatty acid composition in spr2 plants led to the predominant emission of saturated C6 volatiles in response to wounding. The expression of 1-deoxy-d-xylulose 5-phosphate synthase (DXS2), a key gene involved in VOC synthesis in the chloroplast, was only upregulated in Manduca sexta L.-damaged Wt and 35S::prosys plants. However, its expression was restored in spr2 plants by exogenous LA or JA, suggesting that abated VOC emissions in spr2 plants are correlated with lowered DXS2 expression. Bioassays with two different insects showed that adult females significantly preferred spr2 plants, indicating that lowered levels of VOCs in tomato influence plant selection by insects during oviposition."
Roles of plant volatiles in defence against microbial pathogens and microbial exploitation of volatiles,"Plants emit a large variety of volatile organic compounds during infection by pathogenic microbes, including terpenes, aromatics, nitrogen-containing compounds, and fatty acid derivatives, as well as the volatile plant hormones, methyl jasmonate, and methyl salicylate. Given the general antimicrobial activity of plant volatiles and the timing of emission following infection, these compounds have often been assumed to function in defence against pathogens without much solid evidence. In this review, we critically evaluate current knowledge on the toxicity of volatiles to fungi, bacteria, and viruses and their role in plant resistance as well as how they act to induce systemic resistance in uninfected parts of the plant and in neighbouring plants. We also discuss how microbes can detoxify plant volatiles and exploit them as nutrients, attractants for insect vectors, and inducers of volatile emissions, which stimulate immune responses that make plants more susceptible to infection. Although much more is known about plant volatile–herbivore interactions, knowledge of volatile–microbe interactions is growing and it may eventually be possible to harness plant volatiles to reduce disease in agriculture and forestry. Future research in this field can be facilitated by making use of the analytical and molecular tools generated by the prolific research on plant–herbivore interactions."
Significance of terpenoids in induced indirect plant defence against herbivorous arthropods,"Many plants respond to herbivory by arthropods with an induced emission of volatiles such as green leaf volatiles and terpenoids. These herbivore-induced plant volatiles (HIPVs) can attract carnivores, for example, predators and parasitoids. We investigated the significance of terpenoids in attracting herbivores and carnivores in two tritrophic systems where we manipulated the terpenoid emission by treating the plants with fosmidomycin, which inhibits one of the terpenoid biosynthetic pathways and consequently terpenoid emission."
"Squalene – biochemistry, molecular biology, process biotechnology, and applications","Squalene is a natural triterpene and an important intermediate of sterol and hopanoid biosynthesis in various types of cell from bacteria to human. Synthesis and further conversion of squalene are key steps in the metabolism of sterols and related components. Here we summarize the recent knowledge of squalene biochemistry, its molecular properties, and its physiological effects. We compare squalene biosynthetic pathways in different cell types and describe biotechnological strategies to isolate this lipid. Finally, applications of squalene in nutrition, pharmacy, and medicine are discussed."
Synthetic biology for production of natural and new-to-nature terpenoids in photosynthetic organisms,"With tens of thousands of characterized members, terpenoids constitute the largest class of natural compounds that are synthesized by all living organisms. Several terpenoids play primary roles in the maintenance of cell membrane fluidity, as pigments or as phytohormones, but most of them function as specialized metabolites that are involved in plant resistance to herbivores or plant–environment interactions. Terpenoids are an essential component of human nutrition, and many are economically important pharmaceuticals, aromatics and potential next-generation biofuels. Because of the often low abundance in their natural source, as well as the demand for novel terpenoid structures with new or improved bioactivities, terpenoid biosynthesis has become a prime target for metabolic engineering and synthetic biology projects. In this review we focus on the creation of new-to-nature or tailor-made plant-derived terpenoids in photosynthetic organisms, in particular by means of combinatorial biosynthesis and the activation of silent metabolism. We reflect on the characteristics of different potential photosynthetic host organisms and recent advances in synthetic biology and discuss their utility for the (heterologous) production of (novel) terpenoids."
Targeted proteomics using selected reaction monitoring reveals the induction of specific terpene synthases in a multi-level study of methyl jasmonate-treated Norway spruce (Picea abies ),"Induction of terpene synthase (TPS) gene expression and enzyme activity is known to occur in response to various chemical and biological stimuli in several species of spruce (genus Picea). However, high sequence identity between TPS family members has made it difficult to determine the induction patterns of individual TPS at the protein and transcript levels and whether specific TPS enzymes respond differentially to treatment. In the present study we used a multi-level approach to measure the induction and activity of TPS enzymes in protein extracts of Norway spruce (Picea abies) bark tissue following treatment with methyl jasmonate (MeJA). Measurements were made on the transcript, protein, enzyme activity and metabolite levels. Using a relatively new proteomics application, selective reaction monitoring (SRM), it was possible to differentiate and quantitatively measure the abundance of several known TPS proteins and three 1-deoxy-d-xylulose 5-phosphate synthase (DXS) isoforms in Norway spruce. Protein levels of individual TPS and DXS enzymes were differentially induced upon MeJA treatment and good correlation was generally observed between induction of transcripts, proteins, and enzyme activities. Most of the mono- and diterpenoid metabolites accumulated with similar temporal patterns of induction as part of the coordinated multi-compound chemical defense response. Protein and enzyme activity levels of the monoTPS (+)-3-carene synthase and the corresponding accumulation of (+)-3-carene was induced to a higher fold change than any other TPS or metabolite measured, indicating an important role in the induced terpenoid defense response in Norway spruce."
Temperature and light dependence of ß-caryophyllene emission rates,"[1] Assessments of the overall release of reactive volatile organic compounds from vegetation require the knowledge of the effect of temperature and light intensity on emission rates. The aim of the study presented here was to investigate whether the rates of emission of the highly reactive sesquiterpene ß-Caryophyllene (BCAR) from foliage of orange trees (Citrus sinensis (L.) OSBECK, var. Navel and Navel Late), detected using branch enclosures in an orange orchard in Spain, were not only temperature but also light dependent. We used two algorithms to calculate the diurnal variation of BCAR emission rates from environmental data. One algorithm accounted exclusively for the known exponential relationship between emission rate and temperature, and the other for both temperature and light effects. Assuming a light and temperature dependence of BCAR emission rates led to a more precise prediction of the short-term variation of BCAR emission rates than assuming that emissions are affected exclusively by temperature. The light dependence of BCAR emission rates could be due to a modulation of BCAR synthesis by light, or to an enhanced volatilization of BCAR from storage pools under high light exposure, or a combination of both. The data show that present assessments of the total release of reactive volatile organic compounds from vegetation, disregarding light effects on BCAR emission, are highly uncertain, if BCAR considerably contributes to total terpenoid emissions of the investigated plants."
Terpene glucoside production: Improved biocatalytic processes using glycosyltransferases,"Terpenoids are one of the main classes of natural products. In plants, a large fraction of the terpenoids is present as nonvolatile glycosides. The terpene glycosides have attracted much attention as antimicrobials, flavor precursors, and detergents. They are either extracted from plant materials or are synthesized by chemical and biocatalytic methods. Up to now, biotechnological production of terpene glycosides is based on reversed hydrolysis performed by glycosidases. However, this method suffers from low yields as a matter of principle. Recently, the first uridine diphosphate-glucose:monoterpenol ß-d-glucosyltransferase (GT) genes were cloned and characterized from grapevine (Vitis vinifera) and kiwi (Actinidia deliciosa). Heterologous expression in Escherichia coli yielded promiscuous GT enzymes that efficiently glucosylated primary monoterpenols, simple alcohols, and phenols. The GT enzymes differed in substrate preference and activity toward their terpenoid substrates. Biotransformation experiments confirmed the applicability of the novel GTs in biocatalytic processes for the production of these novel compounds. In the near future, terpene glucosides will become commercially available for food, cosmetic, and pharmaceutical industry due to improved biocatalytic processes involving GT enzymes."
Terpenoid biomaterials,"Terpenoids (isoprenoids) encompass more than 40 000 structures and form the largest class of all known plant metabolites. Some terpenoids have well-characterized physiological functions that are common to most plant species. In addition, many of the structurally diverse plant terpenoids may function in taxonomically more discrete, specialized interactions with other organisms. Historically, specialized terpenoids, together with alkaloids and many of the phenolics, have been referred to as secondary metabolites. More recently, these compounds have become widely recognized, conceptually and/or empirically, for their essential ecological functions in plant biology. Owing to their diverse biological activities and their diverse physical and chemical properties, terpenoid plant chemicals have been exploited by humans as traditional biomaterials in the form of complex mixtures or in the form of more or less pure compounds since ancient times. Plant terpenoids are widely used as industrially relevant chemicals, including many pharmaceuticals, flavours, fragrances, pesticides and disinfectants, and as large-volume feedstocks for chemical industries. Recently, there has been a renaissance of awareness of plant terpenoids as a valuable biological resource for societies that will have to become less reliant on petrochemicals. Harnessing the powers of plant and microbial systems for production of economically valuable plant terpenoids requires interdisciplinary and often expensive research into their chemistry, biosynthesis and genomics, as well as metabolic and biochemical engineering. This paper provides an overview of the formation of hemi-, mono-, sesqui- and diterpenoids in plants, and highlights some well-established examples for these classes of terpenoids in the context of biomaterials and biofuels."
Terpenoid Biosynthesis and Specialized Vascular Cells of Conifer Defense,"Defense-related terpenoid biosynthesis in conifers is a dynamic process closely associated with specialized anatomical structures that allows conifers to cope with attack from many potential pests and pathogens. The constitutive and inducible terpenoid defense of conifers involves several hundred different monoterpenes, sesquiterpenes and diterpenes. Changing arrays of these many compounds are formed from the general isoprenoid pathway by activities of large gene families for two classes of enzymes, the terpene synthases and the cytochrome P450-dependent monooxygenases of the CYP720B group. Extensive studies have been conducted on the genomics, proteomics and molecular biochemical characterization of these enzymes. Many of the conifer terpene synthases are multi-product enzymes, and the P450 enzymes of the CYP720B group are promiscuous in catalyzing multiple oxidations, along homologous series of diterpenoids, from a broad spectrum of substrates. The terpene synthases and CYP720B genes respond to authentic or simulated insect attack with increased transcript levels, protein abundance and enzyme activity. The constitutive and induced oleoresin terpenoids for conifer defense accumulate in preformed cortical resin ducts and in xylem trauma-associated resin ducts. Formation of these resin ducts de novo in the cambium zone and developing xylem, following insect attack or treatment of trees with methyl jasmonate, is a unique feature of the induced defense of long-lived conifer trees."
The family of terpene synthases in plants: a mid-size family of genes for specialized metabolism that is highly diversified throughout the kingdom,"Some plant terpenes such as sterols and carotenes are part of primary metabolism and found essentially in all plants. However, the majority of the terpenes found in plants are classified as ‘secondary’ compounds, those chemicals whose synthesis has evolved in plants as a result of selection for increased fitness via better adaptation to the local ecological niche of each species. Thousands of such terpenes have been found in the plant kingdom, but each species is capable of synthesizing only a small fraction of this total. In plants, a family of terpene synthases (TPSs) is responsible for the synthesis of the various terpene molecules from two isomeric 5-carbon precursor ‘building blocks’, leading to 5-carbon isoprene, 10-carbon monoterpenes, 15-carbon sesquiterpenes and 20-carbon diterpenes. The bryophyte Physcomitrella patens has a single TPS gene, copalyl synthase/kaurene synthase (CPS/KS), encoding a bifunctional enzyme producing ent-kaurene, which is a precursor of gibberellins. The genome of the lycophyte Selaginella moellendorffii contains 18 TPS genes, and the genomes of some model angiosperms and gymnosperms contain 40–152 TPS genes, not all of them functional and most of the functional ones having lost activity in either the CPS- or KS-type domains. TPS genes are generally divided into seven clades, with some plant lineages having a majority of their TPS genes in one or two clades, indicating lineage-specific expansion of specific types of genes. Evolutionary plasticity is evident in the TPS family, with closely related enzymes differing in their product profiles, subcellular localization, or the in planta substrates they use."
"The major volatile organic compound emitted from Arabidopsis thalianaflowers, the sesquiterpene (E )-ß-caryophyllene, is a defense against a bacterial pathogen","
"
The role of volatiles in plant communication,"Volatiles mediate the interaction of plants with pollinators, herbivores and their natural enemies, other plants and micro-organisms. With increasing knowledge about these interactions the underlying mechanisms turn out to be increasingly complex. The mechanisms of biosynthesis and perception of volatiles are slowly being uncovered. The increasing scientific knowledge can be used to design and apply volatile-based agricultural strategies."
The scarecrow-like transcription factor SlSCL3 regulates volatile terpene biosynthesis and glandular trichome size in tomato (Solanum lycopersicum),"Tomato (Solanum lycopersicum L.) type VI glandular trichomes that occur on the surface of leaves, stems, young fruits and flowers produce and store a blend of volatile monoterpenes and sesquiterpenes. These compounds play important roles in the interaction with pathogens and herbivorous insects. Although the function of terpene synthases in the biosynthesis of volatile terpenes in tomato has been comprehensively investigated, the deciphering of their transcriptional regulation is only just emerging. We selected transcription factors that are over-expressed in trichomes based on existing transcriptome data and silenced them individually by virus-induced gene silencing. Of these, SlSCL3, a scarecrow-like (SCL) subfamily transcription factor, led to a significant decrease in volatile terpene content and expression of the corresponding terpene synthase genes when its transcription level was downregulated. Overexpression of SlSCL3 dramatically increased both the volatile terpene content and glandular trichome size, whereas its homozygous mutants showed reduced terpene biosynthesis. However, its heterozygous mutants also showed a significantly elevated volatile terpene content and enlarged glandular trichomes, similar to the overexpression plants. SlSCL3 modulates the expression of terpene biosynthetic pathway genes by transcriptional activation, but neither direct protein–DNA binding nor interaction with known regulators was observed. Moreover, transcript levels of the endogenous copy of SlSCL3 were decreased in the overexpression plants but increased in the heterozygous and homozygous mutants, suggesting feedback repression of its own promoter. Taken together, our results provide new insights into the role of SlSCL3 in the complex regulation of volatile terpene biosynthesis and glandular trichome development in tomato."
Two independent biochemical pathways for isopentenyl diphosphate and isoprenoid biosynthesis in higher plants,"In the early times of isoprenoid research, a single pathway was found for the formation of the C5 monomer, isopentenyl diphosphate (IPP), and this acetate/mevalonate pathway was supposed to occur ubiquitously in all living organisms. Now, 40 years later, a totally different IPP biosynthesis route has been detected in eubacteria, green algae and higher plants. In this new pathway glyceraldehyde 3-phosphate (GAP) and pyruvate are precursors of isopentenyl diphosphate, but not acetyl-CoA and mevalonic acid. In green tissues of three higher plants it was shown that all chloroplastbound isoprenoids (ß-carotene, phytyl chains of chlorophylls and nona-prenyl chain of plastoquinone-9) are formed via the GAP/pyruvate pathway, whereas the cytoplasmic sterols are formed via the acetate/mevalonate pathway. Also, isoprene, emitted by various plants at high light conditions by action of the plastid-bound isoprene synthase, is formed via the new GAP/pyruvate pathway. Thus, in higher plants, there exist two separate and biochemically different IPP biosynthesis pathways: (1) the novel alternative GAP/pyruvate pathway apparently bound to the plastidic compartment and (2) the classical cytoplasmic acetate/mevalonate pathway. This new GAP/pyruvate pathway for IPP formation allows a reasonable interpretation of previous odd results concerning the biosynthesis of chloroplast isoprenoids, which, so far, had mainly been interpreted assuming compartmentation differences. The novel GAP/pyruvate pathway for IPP formation in plastids appears as a heritage of their prokaryotic, endosymbiotic ancestors."
Up-regulation of an N-terminal truncated 3-hydroxy-3-methylglutaryl CoA reductase enhances production of essential oils and sterols in transgenic Lavandula latifolia,"Spike lavender (Lavandula latifolia) essential oil is widely used in the perfume, cosmetic, flavouring and pharmaceutical industries. Thus, modifications of yield and composition of this essential oil by genetic engineering should have important scientific and commercial applications. We generated transgenic spike lavender plants expressing the Arabidopsis thaliana HMG1 cDNA, encoding the catalytic domain of 3-hydroxy-3-methylglutaryl CoA reductase (HMGR1S), a key enzyme of the mevalonic acid (MVA) pathway. Transgenic T0 plants accumulated significantly more essential oil constituents as compared to controls (up to 2.1- and 1.8-fold in leaves and flowers, respectively). Enhanced expression of HMGR1S also increased the amount of the end-product sterols, ß-sitosterol and stigmasterol (average differences of 1.8- and 1.9-fold, respectively), but did not affect the accumulation of carotenoids or chlorophylls. We also analysed T1 plants derived from self-pollinated seeds of T0 lines that flowered after growing for 2 years in the greenhouse. The increased levels of essential oil and sterols observed in the transgenic T0 plants were maintained in the progeny that inherited the HMG1 transgene. Our results demonstrate that genetic manipulation of the MVA pathway increases essential oil yield in spike lavender, suggesting a contribution for this cytosolic pathway to monoterpene and sesquiterpene biosynthesis in leaves and flowers of the species."
